Profile ID ,Candidate Name / Job Title,Location,Country,Mandatory Skills,Preferred Skills,Nice-to-Have Skills,Years in Role,Industry Match,Recent Projects (Last 5 Years),Compensation Expectation,Compensation Offered,Compensation Match Score,Leadership Sentiment,Innovation Sentiment,Strategy Sentiment,Technical Depth Sentiment,Teamwork Sentiment
1005,Candidate 6,New York,Germany,"Leadership, Data Analysis, Financial Modeling, Machine Learning","Data Analysis, Project Management, Financial Modeling","Leadership, Cloud Computing",11,Marketing,Worked on a major Finance project,149K,,,Neutral,Negative,Negative,Neutral,Positive
1006,Candidate 7,London,Germany,"Machine Learning, Financial Modeling","Machine Learning, Cloud Computing","Project Management, Cloud Computing, Leadership",6,Technology,Worked on a major Technology project,135K,,,Positive,Neutral,Negative,Negative,Positive
1007,Candidate 8,Paris,Germany,"Marketing Strategy, Project Management, Python","Machine Learning, Cloud Computing","Marketing Strategy, Financial Modeling",19,Finance,Worked on a major Healthcare project,141K,,,Neutral,Positive,Negative,Neutral,Negative
1008,Candidate 9,London,Germany,"Machine Learning, Leadership, Data Analysis, Project Management","Data Analysis, Financial Modeling, Project Management","Financial Modeling, Machine Learning, Project Management, Leadership",12,Finance,Worked on a major Marketing project,116K,,,Neutral,Neutral,Negative,Positive,Positive
1009,Candidate 10,Paris,Germany,"Project Management, Leadership, Marketing Strategy, Financial Modeling","Cloud Computing, Python, Financial Modeling, Project Management","Financial Modeling, Project Management",20,Technology,Worked on a major Marketing project,97K,,,Negative,Positive,Positive,Neutral,Positive
